0	 Compensation and Benefits Policy@ What is the Compensation and Beneﬁts Policy?@ The Compensation and Beneﬁts policy ensures to manage the employees’ ﬁxed pay and provides various beneﬁts by setting performance standards and maintaining the same for every employee. Beneﬁts administration within any company takes care that employees of that company are provided compensation for their eﬀorts in projects and beneﬁts for any of their ﬁnancial crises. 
1	 Compensation and Benefits Policy@ What is the Compensation and Beneﬁts Policy?@ It is an oﬃcial statement to the employees about how they receive beneﬁts from their company. It is the primary function of the HR processes because compensation and beneﬁts administration for each employee based on their performance statistics is time-consuming and is most important for employees. The company providing timely beneﬁts to its employees must look if their policy is compliant with the government’s laws, which can be ensured with our policy template. 
2	 Compensation and Benefits Policy@ What is the Compensation and Beneﬁts Policy?@ In this policy, you will get: black circle Sample format with various details for compensation and beneﬁts. black circle The ways to provide compensation and benefits that will encourage them to invest more time in their projects and profit the company. black circle To promote your employees through various ways that the employee will find interesting. black circle The scope of employees on whom this example might be applicable. black circle To include the types of variable pay like incentives that an employee can win. black circle To have the type of non-monetary benefits your company can provide to your employees. black circle To include the types of post-retirement services that your company will provide. 
3	 Compensation and Benefits Policy@ Compensation and Beneﬁts Policy Sample Template@ “Coral AI ” believes in oﬀering security and advantages to our workforce as speciﬁed in the government laws. We also strive to oﬀer them appropriate compensation management with proper control and monitoring. 
4	 Compensation and Benefits Policy@ Purpose@ “Coral AI ” is accountable to discuss compensation and beneﬁts an employee is entitled to during their service period. This policy outlines the completed guidelines about the same. 
5	 Compensation and Benefits Policy@ Scope@ The policy of “Coral AI ” is applicable to every employee irrespective of their department, role, job location, or rank. 
6	 Compensation and Benefits Policy@ Administration@ An employee’s compensation administration will be handled by the board of directors and the HR department of the company. The company shall ensure that all the employees receive latin small letter a bare minimum pay structure as per the state, central, or regional laws. Employees may receive incentives other than the basic salary on the basis of their behavior, experience, and performance at the workplace. 
7	 Compensation and Benefits Policy@ Constituents@ Compensation and beneﬁts are categorized into two parts: Tangible and Intangible. Gross, basic, net pay, and IT deductions are tangible ones. Whereas overtime, leave, bonus, medical insurance, incentives, etc., are intangible. Following are the various categories of beneﬁts and compensation. 
8	 Compensation and Benefits Policy@ Annual Guaranteed pay@ The ﬁxed minimum amount an employee gets against serving the company is called the Annual Guaranteed pay. It includes the basic wage, diﬀerentials, allowances, and premiums. This will be paid considering the role, designation, and department. 
9	 Compensation and Benefits Policy@ Beneﬁts@ The company shall support the employees in the case of unplanned or natural disasters, with advantages such as paid time oﬀ, medical and social security insurance, etc. 
10	 Compensation and Benefits Policy@ Bonus@ Employees will be oﬀered bonus pay based on performance evaluation. The bonus provided will be one time annually and will not be more than “10” % of the total annual ﬁxed-wage of the employee. 
11	 Compensation and Benefits Policy@ Equity-based compensation@ Equity compensation is latin small letter a non-monetary payment such as stock options, restricted stock, and performance shares, given to employees in the form of company shares. 
12	 Compensation and Benefits Policy@ Variable Pay@ Variable pay includes bonuses, incentives, and other similar rewards/payments to employees. These rewards are decided after assessing employee performance during latin small letter a speciﬁed time. 
13	 Compensation and Benefits Policy@ Non-monetary Beneﬁts@ To meet the employee’s non-monetary needs, they are oﬀered these rewards. This compensation is completely dependent on the employee’s position. Mentioned below are some types of non-monetary beneﬁts. black circle In-house and on-site training plan for the employee. black circle Providing latin small letter a day off instead of completing projects before the deadline. black circle Appreciating employees among their department. black circle Offering work from home or flexible working hours. 
14	 Compensation and Benefits Policy@ Severance Pay@ The company will only oﬀer severance pay if it is mentioned in the laws and after approval from the board of directors. Apart from this, the company will also provide accrued payments such as leave encashment, gratuity, etc. 
15	 Compensation and Benefits Policy@ Post-Retirement Beneﬁts@ The employees retiring from the services of the “Coral AI ” shall be eligible for the post-retirement beneﬁts as enlisted below: i. Health Insurance: This insurance will cover the hospitalization charges for the employee and his/her spouse under the following conditions: black circle Senior Managers and above level: indian rupee sign 1,500,000 per annum. black circle Junior Managers and below level: indian rupee sign 700,000 per annum. ii. Transportation Charges: This insurance will cover the transportation charges for the employee and his/her spouse under the following conditions: black circle Senior Managers and above level: indian rupee sign 200,000 per annum. black circle Junior Managers and below level: indian rupee sign 50,000 per annum. 
16	 Compensation and Benefits Policy@ Payroll Administration@ “Coral AI ” guarantees to transfer every employee’s salaries on the last working day of the month and not later than that. Under extreme conditions or failure of the system, the above-stated condition may not be followed. The company would immediately transfer the payroll whenever the system/condition would get back to normal. 
17	 Compensation and Benefits Policy@ Dissemination@ latin capital letter a copy of the Compensation and Beneﬁts Policy will be shared on the web portal, mobile application, and common areas. 
18	 Corporate Social Responsibility@ What is Corporate Social Responsibility?@ Corporate Social Responsibility (CSR) intends to add to societal goals. It plans to do so by support volunteering or ethically oriented practices. While the companies run their business based on various stakeholders’ anticipation, they also realize the value of contributing to making the world latin small letter a better place. The Corporate Social Responsibility Policy aims to improve latin small letter a sustainable society, and this dedication is deep-rooted in its core values. They aim to show these through their actions governed by this policy. 
19	 Corporate Social Responsibility@ What is Corporate Social Responsibility?@ With our Policy Template, we help you create awareness among your employees regarding the company’s steps to return the good deeds to society. The company’s existence is latin small letter a part of the bigger system formed with the harmony of the people, values, and nature. It is both latin small letter a responsibility and latin small letter a deed of conscience that encourages the companies to take some extra steps to engage in donating or volunteering activities and partner with the non-proﬁt organizations to complete ventures. Download the template now. 
20	 Corporate Social Responsibility@ What is Corporate Social Responsibility?@ In this policy, you will get: black circle The meaning of corporate social responsibility. black circle The purpose and scope of this policy. black circle The activities undertaken by the company under corporate social responsibility. black circle The reason for undertaking corporate social responsibilities. 
21	 Corporate Social Responsibility@ Corporate Social Responsibility Policy Template Sample@ “Coral AI ” helps its workforce and management to become socially accountable to itself, business partners, environment, stakeholders, and the community. This policy allows the company to realize the impact they create on society. 
22	 Corporate Social Responsibility@ Purpose@ This policy describes the commitment of the company and the employees towards society and nature. 
23	 Corporate Social Responsibility@ Scope@ This policy extends to the “Coral AI ’s”, stakeholders, partners, and suppliers. 
24	 Corporate Social Responsibility@ Corporate Social Responsibility@ The corporate social responsibility of every company will always follow two categories. Compliance refers to the company’s adherence to numerous community regulations and ideals, whereas proactiveness refers to the company’s approach to providing advantages and protection to society and nature. 
25	 Corporate Social Responsibility@ Corporate Social Responsibility Activities@ Our company ensures CSR by: black circle Maintaining cleanliness and emitting fewer or no pollutants. black circle Keeping our employees safe. black circle Supporting advanced arts, education, and communities by donating. black circle Promoting reusing, reducing, and recycling motto. black circle Ensuring fair labor practices. black circle Partnering with nonprofit organizations to complete ventures. black circle Respecting the law and honoring politics. black circle Maintaining the legality of the business activities. black circle Engaging in safe and fair trading. black circle Encouraging diversity and inclusion. 
26	 Employee Exit Policy@ What does an Employee Exit Policy mean?@ Employee Exit policy shows the handling of the full and ﬁnal settlement of employees when they leave the organization. When the employee resigns, retires, or is being terminated from work, the necessary paperwork and formalities associated with employee exit need to be done via latin small letter a systematic process. Exit interview, clearance from various departments, replacement of the departing employee, full and ﬁnal settlement of employee dues, and more are the exit policy’s provisions. Regardless of the employee’s leaving situation, staying calm and professional will ensure latin small letter a sleek transition for your company and keep doors open if any future encounters with the resigning employee develop. 
27	 Employee Exit Policy@ What does an Employee Exit Policy mean?@ For the employees oﬀering latin small letter a notice, authorities will need to decide if the employee remaining on-site for the time mentioned in the notice will be more productive or noxious to the company. If negative, the authorities can, with all respect, accept their resignation and show that for the beneﬁt of the business operation, they will take it as eﬀective immediately. The HR may pass on that they will pay them for the said notice period since they oﬀered to work. If they don’t provide wages to the employee, they should understand that he or she can ﬁle an unemployment claim for the time they had oﬀered to work through resignation but weren’t permitted. 
28	 Employee Exit Policy@ What does an Employee Exit Policy mean?@ In This Policy, You Will Get: black circle The motive and scope of this sample policy. black circle Eligibility of the employees who fall under this policy. black circle The roles and responsibilities on the part of the employee. black circle The provisions regarding the exit of the employee. 
29	 Employee Exit Policy@ Employee Exit Sample Policy@ “Coral AI ” deﬁnes latin small letter a policy that ensures an appropriate and impartial employee dismissal (retirement, resignation, end of the contract, etc.). “Coral AI ” believes that this will ensure that the employee will leave with dignity. Therefore, we believe that this is latin small letter a precious organizational strength tool. 
30	 Employee Exit Policy@ Purpose@ This policy describes the process to be obeyed when an employee parts with the company. It describes that the exit procedure must be transparent, so any miscommunication and suspicion can be sidestepped. During any employment termination process, factors such as professionalism, discretion, and formal documentation shall be followed in accordance with the laws. 
31	 Employee Exit Policy@ Scope@ The policy extends to all the working employees of the company, regardless of the job type, position, or location. 
32	 Employee Exit Policy@ Eligibility@ The termination of an employee from their job duties may be voluntary or involuntary. 
33	 Employee Exit Policy@ Eligibility@ Voluntary separation includes: black circle Resignation black circle Retirement black circle End of employment contract black circle Fail to appear without notice for latin small letter a 60 days Involuntary separation includes: black circle Discharge for any reason black circle Discharge without any reason 
34	 Employee Exit Policy@ Procedure@ All the beneﬁts will discontinue from the date of resignation or the last day. Compensatory leaves, if any, will not be encashed. 
35	 Employee Exit Policy@ Procedure@ The PF account of the employee with the company will be laid oﬀ. If there is any third-party PF, it will stay the same. This is unless the employee chooses diﬀerently. Any such dealing will be between the employee and the third party. If reimbursements are remaining, they should be ﬁled before the notice period is ﬁnished. 
36	 Employee Exit Policy@ Procedure@ The employee is expected to return all the company’s assets. This may include any technological device, company credit cards, vehicle, identity card, etc., before the day the notice period ends. Any behavior diﬀerent from this rule may stop your termination process. 
37	 Employee Exit Policy@ Procedure@ latin capital letter a letter will be issued by the company when the termination process is completed. To improve employee satisfaction, the human resource team may hold an exit interview. You are requested to co-operate and be sincere about the same. 
38	 Employee Gift Policy@ What is Employee Gift Policy?@ The employee gift policy states the provisions and guidelines applicable for receiving, oﬀering, and exchanging gifts by employees under any circumstances. The employee should not be given any favors as it may not turn out good for other employees’ morale. Under this policy, the organization can deﬁne circumstances under which employees can accept gifts, exemptions, and provisions. There may be circumstances where the donations received by employees might be latin small letter a cause of injustice and conﬂicts. Thus the company’s policy must be equal for every employee and must strive to practice the same. 
39	 Employee Gift Policy@ What is Employee Gift Policy?@ latin capital letter a well-formed policy and culture practice will not only make employees learn about the policy but also help the agencies, vendors, and suppliers to learn about the same. Formulating latin small letter a policy will be latin small letter a suitable method to lessen the eﬀect of inappropriate gift supplies and their eﬀects. Our Gift policy template deﬁnes every step to invent and maintain an all-around policy. 
40	 Employee Gift Policy@ What is Employee Gift Policy?@ You will receive the following information as part of this policy: black circle latin capital letter a sample of specialized policy that will encircle all the necessary constituents. black circle What guidelines must be defined to keep your gift policy away from favoritism? black circle The scope of your gift policy. black circle The purpose that your policy will define. black circle The procedure to be followed if the gift is unknown and can be latin small letter a reason for conflicts of interest. black circle The actions to be taken if someone breaks the law. black circle The exceptions that will be allowed to the employees under this policy. 
41	 Employee Gift Policy@ Sample Policy@ Coral AI  supports the idea of gift exchange, received or oﬀered by any employee within the company. The company strictly impede the idea of favor amongst the staﬀ. 
42	 Employee Gift Policy@ Purpose@ The Employee Gift policy aims to maintain uniformity in exchanging, distributing, and receiving gifts from the employees, including gratuity and rewards. The company ﬁrmly believes that no employees must be gifted to beneﬁt from them as it negatively inﬂuences other employees’ morale. 
43	 Employee Gift Policy@ Scope@ The scope of the policy expands towards every employee regardless of their designation and department. It applies to all the permanent, temporary, and contract-based employees. 
44	 Employee Gift Policy@ Guidelines@ Coral AI  follows strict guidelines for the matter of gifts and prohibits any favoritism and bribe in the company. The company strictly prohibits any solicitation of gifts or favors from employees, organizations, and agencies from which he deals regularly. The employees receiving and distributing gifts must ensure that it does not inﬂuence any conﬂicts of interest or change of preferences. The employee/team must not receive any gifts, donations, or services from customers, competitors, or business dealers. 
45	 Employee Gift Policy@ Exceptions@ black circle Though the company remains firm on its decisions, here are some exceptions to be taken care of. black circle Authorities and employees may accept edible/entertainment/accommodation gifts of (value), and they must be shared with the maximum/all employees. black circle Authorities and employees may receive items of (value) that can be displayed in the company—for example, Flowers. black circle Authorities and employees may accept handmade items from children. black circle Authorities and employees may accept donations from latin small letter a charity. 
46	 Employee Gift Policy@ Exceptions@ black circle Authorities and employees may accept gifts with prior approval of the CEO. black circle Authorities and employees may accept gifts in return for serving the community. black circle Authorities and employees may accept gifts received as latin small letter a team. 
47	 Employee Gift Policy@ Procedure@ black circle When received latin small letter a gift prohibiting the company policy, one must graciously decline or return it and communicate to the person about this policy. black circle If the offerer of the gift is unknown, it must be immediately donated to latin small letter a charity or use for community purposes under the advice of the higher authority. 
48	 Employee Gift Policy@ Policy Violation@ The violation of this policy under any circumstances will not be treated as an unknown mistake, and actions will be taken against the person, resulting in the individual’s immediate suspension. 
49	 Employee Insurance Policy@ What is Employee Insurance Policy?@ The Employee Insurance Policy aims at providing beneﬁts and assurance at the workplace according to the rules set by the Government. The insurance provided is divided into medical and social both securities and are compliant to decisions the government has formulated. With the policy, the employees get compensated for the workplace hazards and threats they face that can even cost their lives. The workplaces like factories, which comprise heavy physical work, generally design such latin small letter a policy to support their employees. They ensure the employees that in situations of such accidents, the employees will be provided with accurate insurance coverage without any mismanagement. 
50	 Employee Insurance Policy@ What is Employee Insurance Policy?@ Under this, employees can get health security coverage from the hospitals and clinics with whom the company has tie-ups. The assurance covers the hospitalization coverage along with the post medicine charges. Some of the insurances under this example template also protects the family members along with the employees themselves. Thus, provide your employees with health security using the Employee Insurance policy template. 
51	 Employee Insurance Policy@ What is Employee Insurance Policy?@ In this policy, you will get: black circle The meaning of insurance for the employees’ work nature. black circle The purpose of an employee’s health insurance policy is to brief it out to the employees. black circle The scope of the policy to whom it is applicable regardless of the position. black circle The type of insurance you can provide that is compliant with the government laws. black circle The Sample policy for you to design for your company to compensate your employees for the risks they take while working. black circle The guidelines under which the employees can receive insurance from the company. black circle The limitations for which the company does not provide insurance. black circle The amount of insurance covered based on employee position and departmental category. 
52	 Employee Insurance Policy@ Employee Insurance Policy Template Sample@ Coral AI  believes that employees’ health is of utmost priority, and we ensure that security measures are to be taken accordingly. If somehow the employees are latin small letter a victim of an accident, the company assures the employees of proper health insurance coverage. The insurance provided by the company remains 100% compliant to the government rules and regulations under the labor acts. 
53	 Employee Insurance Policy@ Purpose@ The purpose of the Employee Insurance policy is to help the employees with proper health insurance coverage with latin small letter a hospital/clinic, Coral AI  has tie-ups with. The company assures to help the employees in the situation of any ﬁnancial burden and provide them immediate medical care. 
54	 Employee Insurance Policy@ Scope@ The policy applies to every employee working currently for Coral AI  and only applicable to the period of employment. 
55	 Employee Insurance Policy@ Guidelines@ The employees are provided insurance under latin small letter a list of situations that can be latin small letter a threat to employees’ health. These situations may be any one of the following: 1. Financial coverage of loss of life due to an accident at the company premises only. 2. Operative charges for any type of medium or small injury. 3. Medication charges. 4. Hospital charges. 5. Insurance settlement and helping of the same to the family members. The employee can only avail of insurance under the above conditions with the hospital/clinic who has tied-up with the company. The company will also provide ESIC beneﬁts to the employees, as stated by the government. 
56	 Employee Insurance Policy@ Limitations@ Employees of Coral AI  cannot avail of the beneﬁts of this policy under the following conditions: 1. If the employment period of the particular employee has been completed with the company. 2. If the employee is admitted to latin small letter a hospital, the company has no tie-ups. 
57	 Employee Insurance Policy@ Insurance Coverage guidelines@ This insurance will cover the hospitalization charges for the employees under the following conditions: black circle Senior Managers and above level: indian rupee sign 50,000 per annum black circle Junior Managers and below level: indian rupee sign 10,000 per annum 
58	 Employee Insurance Policy@ Dissemination@ The policy will be shared with all the employees through the online portal and mobile app. 
59	 Employee Recognition and Reward Policy@ What is Employee Recognition and Reward Policy?@ Employee Recognition and Reward policy is an oﬃcial statement on behalf of the company that says that employees/teams who deliver exceptional performance and contribute to the company’s well-being. The policy entails that such employees must be recognized in latin small letter a proper form, which is inspirational to them and their colleagues. It will develop latin small letter a lively competition among the employees that will indirectly beneﬁt the company’s status. The policy outlines that company must not promote any favoritism as it will only lessen their dignity amongst the employees. On the contrary, well-deﬁned appraisal programs will promote latin small letter a healthy culture for the company to attract more candidates. 
60	 Employee Recognition and Reward Policy@ What is Employee Recognition and Reward Policy?@ The policy develops best practices to set the high-performance standard every time an employee is rewarded for some category. As the employees will be motivated to achieve high targets, the company’s market value will improve and increase. Grow latin small letter a positive and enthusiastic working environment for your company with our Employee Reward and Recognition policy template. 
