170	 Overtime Policy@ Mandatory overtime@ Often an organization may require their employees to work extra due to peak hours. Working extra hours is seen as latin small letter a requirement when the need arises. Declining the proposal after the fair notice can trigger disciplinary actions such as termination or elongation of probation. 
171	 Overtime Policy@ Limitations to overtime@ latin capital letter a few limitations to consider while considering extra working are: black circle Employees should always try to complete latin small letter a given task within regular working hours. black circle Overtime should only be used under emergencies or urgent situations where work exceeds regular official hours; hence, the tasks given are generally designed to keep latin small letter a standard workweek in mind. black circle Employees are not encouraged to view the availability of working extra as extra income, meaning it should be looked at as latin small letter a last alternative for the overload of work and tight deadlines, etc. 
172	 Overtime Policy@ Healthy overtime arrangements@ After-hours working is not latin small letter a promotable option. Safety measures around the use of overtime are necessary as no organization would like loss of morale and productivity or other overwork accidents. black circle Accurate logs of overtime worked must be recorded and maintained. black circle Strongly advise the employees to view this option as latin small letter a last resort in times of emergency. black circle It is mandatory to offer the provisions to complete work during office hours. black circle In case of observing low productivity or problems concerning increased office hours, it is suggested to decrease this facility. black circle latin capital letter a limit should be kept in place to promote latin small letter a proper work-life balance and an if an employee exceeds the employee’s mental health concerns. However, specified overtime cap, then that will be paid considering legal rules. 
173	 Overtime Policy@ Consequences of unauthorized overtime@ Employees found violating overtime guidelines such as unapproved hours or slacking productivity during standard company hours purposefully to avail beneﬁts can face the consequences. It can be prolonged probation or even termination, whichever suits the oﬀense. 
174	 Overtime Policy@ Procedure@ Both employer and employee must save accurate records to ensure overtime pay. In addition, there are speciﬁc protocols to follow for latin small letter a smooth process, such as: black circle The manager and their team must come to an agreement on time restrictions. The manager must also guarantee that the agreed-upon limit does not conflict with legal limits and that the employees do not work excessively long hours. black circle The manager has to make employees aware of their eligibility. They are also required to know details regarding benefits, processes, limits, credits, etc. black circle Precise recording of overtime is necessary from both the manager’s end and the employee’s end; this is then reviewed by the HR team. black circle HR has to calculate the employee’s pay in accordance with legal overtime pay rates and deploy the same with the next scheduled payday. 
175	 Payroll Policy@ What is Payroll Policy?@ Any organization’s most essential component is human resources. They rise and fall with the organization’s growth. It is crucial to compensate the employees for their vital services and impenetrable loyalty towards the organization. latin capital letter a payroll policy explains the process of payment to the employees as it envelopes the administration of the salaries, time-sheet keeping, wage methods, and payment schedules of an organization’s employees. This policy is deﬁned to place control and make employees conscious of what they should anticipate on pay-day. Any payroll policy should specify the responsibilities and accountabilities of staﬀ managing the same. Since payroll covers sensitive and conﬁdential information, the policy should also deﬁne access and safety levels. The policy should diﬀerentiate the preparation required by various employee groups. To implement and streamline payroll policy in your organization you need payroll management software that will automate your redundant tasks. 
176	 Payroll Policy@ What is Payroll Policy?@ All the operations should be certiﬁcated in detail in the policy handbook, which covers everything from employee hiring to separation. These procedures cover payment processing activities required for managing new contracts, time reporting, work changes, outstanding payments, data updates, deductions, and alienation. This policy covers the payment processing services provided by the organization, the legislative requirements it must comply with, and determining the employment status of workers. 
177	 Payroll Policy@ What is Payroll Policy?@ In This Policy, You Will Get: black circle Sample Payroll Policy including all the components of employee payroll. black circle The purpose defined by the payroll policy. black circle The scope of employees included receiving payroll. black circle What type of constituents to be included to complete the payroll without hurting your employees. black circle Responsibility of the Payroll Administration to look after the payroll needs of the company. black circle Responsibility of the Payroll Team to confirm the accounting reports in compliance with the legislature. 
178	 Payroll Policy@ Payroll Policy Sample@ ‘Coral AI ’ understands the importance of payroll for employees and works the fullest to process each employee’s payment before the speciﬁed date of every month. The policy covers every component for calculations while keeping it compliant with government rules. 
179	 Payroll Policy@ Purpose@ The purpose of the Payroll policy is to complete every employee’s payment before the (date) of every month without any irregularities. 
180	 Payroll Policy@ Scope@ The payroll policy applies to every employee regardless of their status in the company. 
181	 Payroll Policy@ Payroll Administration@ ‘Coral AI ’ ensures to keep latin small letter a transparent pay structure for each employee along with detailing the regular pay, overtime, time-sheet maintenance, compensations, bonuses, and reimbursements, whichever is actively existing. The payroll administration of the company looks after every component stated above while keeping the payment of employees fully compliant. 
182	 Payroll Policy@ Components of Pay@ The payroll service of the company entails every small detail to support and motivate their employees. The components that are included in the salary are enlisted below: 
183	 Payroll Policy@ Basic pay@ It outlines the gross earnings that employees earn according to their salary structure deﬁned. 
184	 Payroll Policy@ Time-sheet keeping@ The time-sheet comprises the daily details of the working hours and activities completed throughout the day. 
185	 Payroll Policy@ Bonus@ The bonus is the amount that employees can receive for any excellent performance. 
186	 Payroll Policy@ Overtime@ Any overtime hours worked by the employees will be counted according to the pro-rate basis and it will comply with the rules stated by the government. 
187	 Payroll Policy@ Tax information@ The tax such as TDS, PF, ESIC, etc. will be deducted from the salary for which will be prior informed to all employees. The company will also share form-16 with the employee, which they can use for tax return. 
188	 Payroll Policy@ Investment Declarations@ The employees can submit any investment declarations, and the company conﬁrms that it will be added to their salary structure. 
189	 Payroll Policy@ Travel reimbursements@ Any reimbursement amounts remaining to return will be included in the salary. 
190	 Payroll Policy@ Encashments@ The pending leaves of employees will be encashed through the salary according to the Leave policy instructions. 
191	 Payroll Policy@ Loan deductions@ Company can also deduct the loan amount through installments and inform the employees about the same. 
192	 Payroll Policy@ Payroll Accounting@ Payroll administration must conﬁrm that every payroll reports, ledger, bank reconciliations, and salary structures remain up-to-date for any audit check. 
193	 Probation Policy@ What is Probation Policy?@ Appointing latin small letter a recruit as latin small letter a permanent employee from day one of joining the organization may not be fruitful. In some instances, even after acing the interviews, the employee–organization relationship may not work out. This can happen due to several reasons: one of them being the lack of compatibility between the organization and the recruit. To avoid such latin small letter a short-lived employment relationship, the organization implements latin small letter a Probation Policy, which is essentially latin small letter a trial period between the recruit’s date of joining the organization until he is given latin small letter a permanent employee status. 
194	 Probation Policy@ What is Probation Policy?@ This allows both employer and the organization to know each other better and decide whether this is the right partnership. Apart from this, the employee can use this time to discover if he is comfortable with the organization’s working environment and job responsibilities. If the organization feels that the employee is suitable for the organization and its working environment, the employee is appointed as latin small letter a permanent employee. In the opposite circumstances, the employment is terminated. 
195	 Probation Policy@ What is Probation Policy?@ This policy gives latin small letter a clear indication of all the provisions regarding this trial period. It explains clearly what an employee should or should not do. The policy emphasizes that the employer’s decision is based purely on the recruit’s performance and behavior and ability to adapt to the working environment. With our Probation Policy, make sure the recruits have latin small letter a clear idea about this trial period’s rules and process. 
196	 Probation Policy@ What is Probation Policy?@ The sample policy involves the below sections. black circle The organization’s intent to implement this policy. black circle The purpose of this policy. black circle The eligibility of the employees to be covered under this policy. black circle The definition in the context of this policy. black circle Provisions regarding the termination of employment during the probationary period. 
197	 Probation Policy@ Probation Policy Template Sample@ Coral AI believes that every company requires latin small letter a policy that allows latin small letter a brief period for the employees to get comfortable with the organization. This time allows both the employer and the employee to decide whether the other one is the right choice or not. 
198	 Probation Policy@ Purpose@ This policy outlines all the rules to be considered when managing an employee’s probation. 
199	 Probation Policy@ Scope@ This policy is applicable to the newly recruited employees of the company. In addition, any current employees who received latin small letter a promotion to higher designation and who are being disciplined are also eligible for probation. 
200	 Probation Policy@ Deﬁnition@ The time spent by an employee in the company after signing the job agreement till becoming latin small letter a permanent employee is called latin small letter a probation period. Employees will be trained to learn and improve new skills and responsibilities during probation. This time is useful for employers to assess the roles and responsibilities handled by the employees and to understand if they are latin small letter a perfect ﬁt for the job. The following factors shall be helpful for the employer to make the decision. black circle Expertise, skills, and abilities at work. black circle Development on assignments. black circle Personal qualities such as accountabilities, loyalty, etc. black circle Behavior in the company. These factors shall be documented as they are valuable for the employer to make the ﬁnal decision. 
201	 Probation Policy@ Termination during Probationary Period@ An employee may be terminated at any point during the probation period if they do not qualify for the position, possess inappropriate behavior, or show unsatisfactory performance. Such termination does not require any prior warning to the employee. 
202	 Probation Policy@ Termination during Probationary Period@ Sometimes employees may be terminated before the end of their probation time. The employee will be handed latin small letter a written notice of their termination, which will describe the reasons for the same. 
203	 Probation Policy@ Termination during Probationary Period@ Moreover, if the employee is to be ﬁred after their probation, the employer shall follow all the rules of the termination policy. 
204	 PTO Policy@ What is the PTO Policy?@ It is seen that more than half of the adult population is spending about one-third of their time in oﬃce. It is essential to oﬀer them ﬁxed time-oﬀ to be used in times of stress or relaxation to maintain their work-life balance, which is not calculated in loss of pay. This time-oﬀ is excluded from the privilege, casual and sick leave. More time at work can cause hindrance to attentiveness to work and personal life also. 
205	 PTO Policy@ What is the PTO Policy?@ Employees can take such time oﬀ any time they need. Eventually, it can help them to equalize personal and private life, along with bringing energy to the job after long hours of hard work. It is special time-oﬀ that employees can also use for their personal needs like family events, vacations, etc. It also acts as latin small letter a positive inﬂuence for the employers in their talent hiring process to attract more talents. Moreover, the PTO Policy also helps the company in developing latin small letter a positive culture change in the working environment that will improve the productivity of employees in achieving the organizational targets. 
206	 PTO Policy@ What is the PTO Policy?@ Know the following criteria in the sample policy. black circle The importance of paid time-off for employees to keep them relaxed and motivated at work. black circle The amount of time off to be provided to different employees according to their categories. black circle To which employees this policy will apply. black circle The purpose and brief of what is paid time and why it is required. black circle Sample policy to assist you in designing for your company. black circle The guidelines on how to use the offered time-off and necessary regulations on it for the employees. 
207	 PTO Policy@ PTO Policy Template Sample@ Under the PTO policy, Coral AI oﬀers its employees monthly/yearly ﬁxed hours of time-oﬀ, which they can use whenever they want. The company believes that employees also want speciﬁc time away from the busy schedule of work. This policy oﬀers time-oﬀ according to what the government has stated. 
208	 PTO Policy@ Purpose@ The purpose of the PTO policy is to oﬀer employees some time from their schedules so that they can relax or spend some time with their families. 
209	 PTO Policy@ Scope@ This policy applies to every full-time, part-time, and contractual employee regardless of their position and department in the company. 
210	 PTO Policy@ Guidelines@ Though Coral AI understands the importance of personal time-oﬀ required, certain speciﬁcations need to be followed not to violate the policy. 1. An employee should never take more than digit five of time-off. 2. An employee should not take time off during any important undergoing project regardless of latin small letter a genuine reason. 3. No employees are allowed to use PTO before digit three months after their joining. 4. The PTO offered to the employees is different from the privilege, sick, and casual leaves so as to comply with government rules. 5. Employees must state the reason for applying for PTO if the time-off exceeds 5. 6. Exceeding the quota of paid time-off, no employees can apply for it. If used, it will be considered unpaid time-off. 7. The pending PTO may be carried forwarded to the next year as per the board of directors’ decision. 8. The pending PTO will not be encashed in the next year). 
211	 PTO Policy@ Time-off Speciﬁcation@ Based on the employee category, the time-oﬀ oﬀered is diﬀerent is stated as under: 1. Full-time employees receive digit two days multiplied by months of the contract. 2. Part-time employees receive digit two days multiplied by months of the contract. 3. No employees are allowed to use PTO before digit three after their joining. 
212	 Sick Leave Policy@ What is the Sick Leave Policy?@ Sick leaves are used by employees when they cannot come to work due to their illness or any relatives’. Sick leave policy is latin small letter a sample that states how much leaves employees can take, what the frequency to avail is, etc. Mostly the number of such leaves is ﬁxed by the organization under the adherence of legislature laws. Pending Sick leaves can be encashed or carried forwarded as per the wish of the employer. It must be ensured that employees don’t feel any pressure of work during latin small letter a particular time. The policy must provide latin small letter a healthy kick-start with motivation to the next working day. 
213	 Sick Leave Policy@ What is the Sick Leave Policy?@ In This Policy, You Will Get: black circle The main purpose of the policy is to motivate the employee to get well soon and return to the company with the same productivity which he served before falling ill. black circle If the employee is disabled, he may be entitled for extended leave which would be granted on latin small letter a case to case basis by the management. black circle If the employee is hospitalised for more than 24 hours, or disabled, he is entitled to submit latin small letter a certificate of fitness to resume his duties. black circle According to the new deﬁnition of the sick leave, taking care of an ill family member is also considered an eligible reason for applying for sick leave. black circle In case of unused sick leaves, the employees are allowed to carry forward the same up to latin small letter a certain period of time. black circle This feature also helps the employee to refrain from abusing the benefits of sick leaves. 
214	 Sick Leave Policy@ Sick Leave Policy Sample@ Traditionally, sick leave is deﬁned as paid time oﬀ for an employee in the case of illness or need of medical attention. And though this is latin small letter a law in some regions, there are latin small letter a lot more places that are yet to pass latin small letter a law regarding latin small letter a paid sick leave policy. However, most organizations tend to oﬀer sick leave to their employees, paid or otherwise, and tend to have some form of latin small letter a sick leave policy in place. Ideally, these policies require latin small letter a sound design and proper planning, which is not the norm everywhere. 
215	 Sick Leave Policy@ Purpose ampersand Scope@ Every organization allows latin small letter a certain number of days of sick leave to each employee beginning on 1st January every year. Some factors to consider are the work culture at the company, the company’s policy regarding leaves, the eﬀect of the job on the employee’s well-being, etc. The sick leave policy is an organization’s guidelines for when an employee falls sick and cannot attend work on latin small letter a particular day(s). Staying home in such latin small letter a situation is ideal from both the individual’s point of view as well as the company’s point of view. From the individual’s perspective, the added stress of travel and work could hamper their road to recovery, adversely aﬀecting their productivity in the short term. As far as the organization is concerned, the concerned employee staying at home improves his rate of recovery, which could reduce the number of overall sick days availed by the employee. This also ensures that the employee does not spread the disease to his/her colleagues, thereby maintaining overall productivity. In cases of mild sickness, the employee could avail the option of work-from-home if applicable, which is latin small letter a good middle-ground for all parties concerned. 
216	 Sick Leave Policy@ Employees with disabilities@ Disabled employees, whether temporary or permanent, must be eligible for extended leave. However, in most organisations, the requests for extended leave are handled case-by-case. These requests are usually subject to the discretion of the manager/team leader/supervisor/HR. In the event of hospitalisation of an employee for 24 hours or more, the employee, disabled or otherwise, could be asked for latin small letter a ﬁtness certiﬁcate to resume his duties. 
217	 Sick Leave Policy@ Procedure@ Though, as mentioned earlier, the traditional deﬁnition of sick leave is the time oﬀ for an employee in case of an illness or in need of medical attention, this deﬁnition has changed over time. Now, sick leave can typically be availed under the following circumstances: black circle Recovery from an existing illness. black circle Resurrection from an accident. black circle Health check-ups in case of sicknesses. black circle To care for an ill family member. 
218	 Sick Leave Policy@ Procedure@ The employees should obey the following criteria. If an employee chooses to avail his/her sick leave, they are expected to inform their supervisor or HR or any relevant higher position at least half an hour before their scheduled starting time. They may also be required to produce latin small letter a physician’s certiﬁcate if the HR or manager deems it necessary. However, the above-mentioned supervisor or HR reserves the right to deny sick leaves if and when they deem necessary. In case an employee exhausts all of his/her sick leave, he/she may use his/her vacation leave as sick leave. However, sick leaves can never be treated as vacation leaves. 
219	 Sick Leave Policy@ Accumulated sick leaves@ Employees are allowed to carry forward latin small letter a speciﬁed number of sick leaves to use for up to latin small letter a speciﬁed number of years as deemed reasonable by the management of the organisation. However, in case an employee is terminated or chooses to discontinue, they cannot encash the accumulated sick leaves as they are not latin small letter a part of compensation but rather latin small letter a perk. 
220	 Sick Leave Policy@ Preventing the abuse of sick leave@ Additional perks could be provided to reduce sick leave abuse and reduce the number of leaves. This could come in many forms. For example: black circle latin capital letter a percentage of unused sick leaves could be carried forward, which can then be available later. black circle Another example of this would be latin small letter a case where an employee who avails less than latin small letter a predetermined number of days is eligible for latin small letter a bonus or reward. 
221	 Whistleblower Policy@ What is latin small letter a Whistleblower Policy?@ Whistleblowing refers to reporting an unlawful activity in the organization by any employee of the organization. These activities can be corruption, wrongful trading, sexual harassment, unjust discrimination, etc. latin capital letter a company should guarantee entirely legal trade practices as per the government. However, what activities are being undertaken by our employees secretly may not be in the company’s knowledge. Some employees are aware of these situations or have faced unjust discrimination in the workplace and are willing to take steps against the same. These employees need to be protected to encourage other employees to feel free to bring forward such issues. 
222	 Whistleblower Policy@ What is latin small letter a Whistleblower Policy?@ Whistleblower Policy ensures that the employees who step up against these activities are protected and safeguarded against the accused’s retaliation practices. Retaliation practices are the adverse actions undertaken to punish the employee or get revenge for throwing light on the accused’s criminal trials. 
223	 Whistleblower Policy@ What is latin small letter a Whistleblower Policy?@ However, in some cases, the employee may ﬁle latin small letter a false complaint and present fabricated evidence against the organization or other employees to harm the latter’s reputation or for personal gain. To avoid such instances, the organization must have latin small letter a policy that speciﬁes the actions against such employees and clarify the consequences of such dishonest practices. This policy covers the provisions about actions against such cases. Download our Whistleblower Policy Template to ensure that the employees overcome the fear of retaliation and report the unfair practices. 
224	 Whistleblower Policy@ What is latin small letter a Whistleblower Policy?@ This policy illustrates the following guidelines: black circle Meaning of the term ‘whistleblower’. black circle The purpose and scope of this policy. black circle The fundamentals of this policy. black circle Protection against retaliation. black circle The actions to be taken by the employees. black circle Actions against the employees who fabricate such complaints. 
