61	 Employee Recognition and Reward Policy@ What is Employee Recognition and Reward Policy?@ In this policy, you will get: black circle The definition and purpose of designing rewards and recognition policy. black circle The scope of the policy to which it applies. black circle Sample formulated policy to help you develop for your company. black circle Examples of Employee Appreciation ideas you can use to your company. black circle Guidelines that enable employees to understand the procedure. black circle latin capital letter a well-designed procedure that does not promote favoritism. black circle Sample method to collect nominations under the policy statements. black circle To form latin small letter a unit which notices the work of every employee and delivers rewards to the worthy one. black circle To improve the company culture by adopting such policies for your company. 
62	 Employee Recognition and Reward Policy@ Employee Recognition and Reward Policy Template Sample@ Coral AI  believes that every employee who has an excellent performance must be encouraged and appreciated in an equal and helpful manner. The rewards, company passes on to the employee may be anything but creative, unique, or useful. The responsible team will choose when and for what reason to appreciate employees with rewards. Under this policy, every employee who has performed excellently for the quarter with latin small letter a deﬁned proof of the same will be rewarded in any way that the Coral AI  feels suitable and worthy. 
63	 Employee Recognition and Reward Policy@ Purpose@ The purpose of rewarding employees is to stimulate and trigger latin small letter a spark in employees to perform greater and greater every time. The regular recognition of employees without any alteration will help encourage team eﬀorts, increase organizational value, promote latin small letter a better culture, and improve peers’ behaviors. 
64	 Employee Recognition and Reward Policy@ Scope@ The Scope of this policy expands to every employee who is on latin small letter a full-time employment basis with the company. 
65	 Employee Recognition and Reward Policy@ Guidelines@ 1. An employee should be rewarded for significant efforts made towards the company’s profitability in any possible way. 2. Rewards should be meaningful, unique, and creative to the employees. 3. The reward must promote the culture and working environment of the company. 4. Rewards should not be any adjustments to the company’s salary or other monetary funds to the employee. 
66	 Employee Recognition and Reward Policy@ Employee Recognition and Rewards Alteration@ Coral AI  believes that every employee is equal to them, and every employee must be gifted equally without favoritism. The company will not allow and tolerate any kind of bias for employees. The company will strive to take action against the individual/team who promotes favoritism and guarantees employees to maintain equality. 
67	 Employee Recognition and Reward Policy@ Types of Rewards@ Coral AI  supports the reward category within the listed performance requirements as follows: black circle More than (years) served for the company black circle Excellent usage of skillset black circle Increased customer success black circle Perfect attendance for latin small letter a month black circle Achieving the assigned target before the specified time interval black circle Excellent research for an undertaken topic 
68	 Employee Recognition and Reward Policy@ Reward Guidelines@ The rewards and recognitions distributed by the Coral AI  are categorized according to the following chart: 
69	 Employee Recognition and Reward Policy@ Reward Guidelines@ black circle These rewards do not apply to customary-work expenses like travel, attendance, conferences, and professional organization memberships. black circle Before distributing the Monetary rewards, the authorized unit must consult with the Heads and the Human Resource department. 
70	 Employee Recognition and Reward Policy@ Reward Application Procedure@ Coral AI  encourages distributing the rewards through latin small letter a fair means, and practices are made to collect nominations from every employee of the staﬀ to maintain equity and quality. The unit specially formed to look after the employee engagement will take care that awards are delivered fairly and transparently. They will collect the nominations throughout the year, analyze them, and distribute them regardless of favoritism. 
71	 Employee Recognition and Reward Policy@ Rewards Collection Method@ To ensure latin small letter a transparent reward system in the company, Coral AI  promotes blind voting. The methodology will be carried out as follows: 1. The votes from the employees will be collected without their names. 2. The voter must be able to explain why he/she choose the respective person into this. 3. The unit formed will collate the votes and will analyze it. 4. The reward winner will be announced on the date of delivery. 
72	 Employee Recognition and Reward Policy@ Employee Appreciation Programs@ Coral AI  deﬁnes various programs other than just monetary and Non-monetary rewards for recognitions of its outstanding employees. Special Employee Appreciation Day is celebrated which expresses our trust towards their roles and eﬀorts they have put to make the company stand on latin small letter a higher platform. Some of the examples of other Employee Appreciation Programs include: black circle Team Lunch black circle Endorsements and recommendations black circle Time-off or Day-off black circle Business suggestions black circle Training and career-based rewards black circle Gift of health and many more… At Coral AI  we believe that recognition is not limited to monetary rewards, we happily appreciate our employee through innovative and unique ways which are diﬀerent based on the achievements. 
73	 Employee Reimbursement Policy@ What is Employee Reimbursement Policy?@ An Employee Reimbursement Policy describes the provisions regarding the obligatory practice of any organization: to repay the employees the amount spent by the latter on behalf of the company to complete any oﬃce-related tasks. It must be made clear that the expenses that are refunded to the employees are not latin small letter a part of the regular wage that the organization pays to its employees. 
74	 Employee Reimbursement Policy@ What is Employee Reimbursement Policy?@ Payments made to pay for the meals with latin small letter a client to seal latin small letter a deal, the costs made for the employee’s travel for business purposes, the employee’s medical expense, etc. are some examples of some refundable payments. This policy helps the organization to make sure that the employees do not misuse this rule of refunding the employees. The policy ensures that the employees have latin small letter a limit above which there is no reimbursement provided. Besides, this system decreases the chances of fraud that an employee can commit in the name of work-related expenses. 
75	 Employee Reimbursement Policy@ What is Employee Reimbursement Policy?@ This policy deﬁnes all the reimbursable and non-reimbursable expenses for this policy. The employer can make sure that the employees do not spend more than the set limit. It helps the organization to minimize costs and have control over the employees’ spending. With the help of our policy template, ensures that the employee spending activity is kept under latin small letter a check and the employee expenses refund policy of the company is not being misused. 
76	 Employee Reimbursement Policy@ What is Employee Reimbursement Policy?@ In this policy, you will get: black circle The purpose of implementing this policy. black circle The applicability of this policy. black circle The meaning of work-related expenses. black circle The meaning of qualified expenses. black circle The meaning of unqualified expenses. black circle The guidelines regarding the policy. black circle The provisions regarding the method of refund. 
77	 Employee Reimbursement Policy@ Employee Reimbursement Policy Sample@ ‘Name of the Company’ expects its employees to be responsible and professional when incurring the expenses and applying for the reimbursement of the same. The organization is accountable for the reimbursement for the justiﬁable costs. 
78	 Employee Reimbursement Policy@ Purpose@ This policy describes the reimbursement of the work-related expenses incurred by the employee from his pocket. 
79	 Employee Reimbursement Policy@ Scope@ This policy applies to all the employees who have received permission to incur work-related expenses. 
80	 Employee Reimbursement Policy@ Work-Related Expenses@ Work-related expenses are those costs that the employee incurs while performing their work duties. An expense is considered as latin small letter a work-related expense; the cost must satisfy the following criteria: black circle The expenses are paid by the employee and not reimbursed to him. black circle The expenses have recorded proof like latin small letter a receipt or latin small letter a bill. black circle The expenses were directly related to earning income. 
81	 Employee Reimbursement Policy@ Qualiﬁed Expenses@ The following expenses are considered to be work-related and are eligible for reimbursement: Work Equipment – Purchase of gadgets and equipment like laptops, briefcases, stationery, etc. to increase work eﬃciency. Meals with Clients – Expenses incurred on the lunch or dinner with the clients to seal in the business deals. These meetings must be SCHEDULED in advance and authorized by the HR department. Double House-Keeping – If the employee has latin small letter a second household for the reasons for work, the following expenses are reimbursable: black circle Rent. black circle Necessary furniture (Bed, TV, latin small letter a set of chairs, latin small letter a table, kitchenware, and latin small letter a sofa). black circle Basic bills (Electricity, cooking gas, water, house tax, etc.). 
82	 Employee Reimbursement Policy@ Qualiﬁed Expenses@ Telephone and Internet expenses – When the employee uses latin small letter a separate company-allotted phone for work purposes and pays the costs for the same. Legal Documentation – Any expenses paid by the employee to complete legal work for the company. Medical Care Fees -Medical expenses when the employee falls sick or suﬀers physical damages due to an unsafe workplace. ALL THE EXPENSES MUST BE APPROVED BY THE HR BEFORE INCURRING. 
83	 Employee Reimbursement Policy@ Unqualiﬁed Expenses@ Any expenses not mentioned under the Qualiﬁed Expenses shall be considered as Unqualiﬁed Expenses. The employee shall take prior permission from the organization to pay work-related expenses. The following is latin small letter a list of possible expenses that are unqualiﬁed to be reimbursed. The deﬁnition is not limited to the list. Personal Travelling Expenses – The expenses incurred by the employee to travel for personal reasons. Extended Expenses – The expenses incurred by the employee when they extend their business travel for reasons other than work. Personal Products – Any products like toiletries, grooming products, or cosmetics purchased by the employee for personal use and has no relation to work whatsoever. Traveling to and from work – Not all the expenses of the commute to and from work incurred by the employees are reimbursed. For more information on the same, the employees are advised to refer to the Local Conveyance Policy of the Company. Family Expenses – Any expense incurred for or by the spouse, children, parents, or relatives of the employee on the trip or during company lunch/dinners. 
84	 Employee Reimbursement Policy@ Guidelines@ The employee must possess the receipts of the expenses he intends to be reimbursed. The employee must submit such receipts with the application for reimbursement. The receipts shall be accompanied by latin small letter a summary of the expenses that include: black circle Name of expense. the parties involved and present during the time of incurring such black circle The description and essence of the expense. black circle The intent of the expense. 
85	 Employee Reimbursement Policy@ Guidelines@ The application and the receipts and summary shall be submitted to the Manager for approval. The applications with all the above-mentioned attachments shall be submitted within 15 days from the day of incurring such expenses. In case of lunch/dinners with the clients; black circle The employee shall inform the Manager about such meetings 15 days before the actual meeting. black circle The employee Must not spend more than the amount mentioned by the Manager. black circle This amount varies depending on the scale of business with the clients. In case of traveling expenses, the employees are advised to refer to the traveling expense policy of the company to get detailed information. 
86	 Employee Reimbursement Policy@ Reimbursement of Expenses@ The Manager shall review the reimbursement application and decide on the approval of the same within 15 days from receiving such an application. The Manager must communicate the approval of the reimbursement application to the concerned employee in written form. The employee will receive reimbursement with the next payroll. 
87	 Employee Reimbursement Policy@ Reimbursement of Expenses@ In some cases, the Manager will SPECIFY in latin small letter a written note, if reimbursement will be paid in cash or by cheque separately from the payroll. If the application for reimbursement is rejected, the Manager MUST specify the reasons for such disapproval. 
88	 Employee Reimbursement Policy@ Reimbursement of Expenses@ If the employee spends an amount that exceeds the limits speciﬁed by the Manager, the excess amount will NOT be reimbursed and is to be borne by the employee. 
89	 Employee Retention Policy@ The need of an Employee Retention Policy@ With the growing demographic of millennials in the working population now, the organizations face employee turnover. The generation of millennials is known for being determined to grow. If they are unsatisﬁed with the organization or feel that they cannot grow, they will change the organization. This problem mainly happens in small and medium scale enterprises. All multinational companies have latin small letter a high retention rate. This is the result of all the perks and beneﬁts that they provide to their employees. It is evident that if the employees stopped receiving appreciation and assurance, they would choose to leave them. The company needs to guarantee the employees that they will receive growth opportunities from the organization. With the Employee Retention policy, you can have latin small letter a solution to the employee turnover solution. 
90	 Employee Retention Policy@ The need of an Employee Retention Policy@ This policy contains all the provisions regarding the company’s initiatives to retain its employees and provide latin small letter a surety that the employees will have latin small letter a comfortable working environment, proper communication medium, and assurance for the growth opportunities. Explain all the beneﬁts that the employees receive in this policy. With our Employee Retention Policy Template, ensure that the employees are given latin small letter a sense of security regarding their jobs and potential development opportunities. 
91	 Employee Retention Policy@ The need of an Employee Retention Policy@ In this policy, you will get: black circle The organization’s beliefs about retaining the employees. black circle The purpose of implementing this policy in the organization. black circle The applicability of this policy. black circle Initiatives by the organization to ensure the training and development of the employee. black circle Actions are taken by the company to ensure latin small letter a comfortable working environment. black circle Remunerations and Benefits given by the company to the employee. black circle Company’s efforts to maintain healthy communication between the employer and the employee. 
92	 Employee Retention Policy@ Employee Retention Policy Template Sample@ Coral AI ‘s primary intent when planning the retention strategies is to lessen employee turnover. We believe that the employees are our most valuable treasure and intend to work with them for an extended time. This policy contains the provisions of eﬀorts to retain the employees in our organization. 
93	 Employee Retention Policy@ Purpose@ This policy aims at managing the employees in such latin small letter a way to motivate them to continue working with the organization. 
94	 Employee Retention Policy@ Scope@ This policy applies to all the organization’s current employees irrespective of their hierarchy level in the organization. 
95	 Employee Retention Policy@ Initiatives by the Organization@ Coral AI  takes the following initiatives to ensure employee retention in the organization. 
96	 Employee Retention Policy@ Training and Development@ Coral AI  ensures that the employees are given regular training to help the employee latin small letter t develop and grow. Expenses of the work-related and necessary seminars or courses will be born by the organization. Coral AI  encourages its employees to experiment with new mechanisms to bring latin small letter a change in the worn-out routines. 
97	 Employee Retention Policy@ Comfortable Working Environment@ Coral AI  understands that the company premises is like latin small letter a second home to the employees. The company will guarantee that the employee is comfortable with the working environment. The company will provide the necessary hygiene facility to the employees. The company will make sure to hold team-building activities like having team lunch or latin small letter a trip. 
98	 Employee Retention Policy@ Remuneration and Benefits@ Coral AI  rewards the employees based on the employees’ performance. These rewards can be categorized as bonuses, pay raises, or other presents that distinctly shows our acknowledgment towards the employee’s eﬀorts and value that they deliver to our company. 
99	 Employee Retention Policy@ Communication@ Coral AI  believes that communication is the key to latin small letter a happy organization. The company is responsible for communicating the pay-raise schemes or new job tasks to ensure that the employees know all the essential details. 
100	 Employee Welfare Policy@ Employee Welfare Policy@ 1. In this policy, you will get 2. Employee Welfare Policy Template Sample black circle Purpose black circle Scope black circle Fundamentals of the Policy black circle Initiatives by the Company 
101	 Employee Welfare Policy@ Employee Welfare Policy@ The organization’s eﬀorts to provide beneﬁts, facilities, and services to the employees are part of its Employee Welfare Policy. These activities are undertaken by the organization to ensure that the employees have latin small letter a comfortable and ethical working environment. Welfare activities enhance employees’ morale. They create latin small letter a loyal and satisﬁed workforce in the organization. Besides, they develop an improved image of the company in the employees’ minds. The eﬃciency of the employees increases when the employees can achieve satisfaction from their workplace. Moreover, when an employee has faith in the organization, they are less likely to be inﬂuenced by the trade unions. In fact, with latin small letter a good reputation, the trade union itself shall trust the organization. 
102	 Employee Welfare Policy@ Employee Welfare Policy@ The organizations undertake the well-being activities voluntarily or under statutory compliance. The availability of ﬂexible working hours to meet the employees’ personal life needs is one of the voluntary steps taken by the organization to ensure work-life balance for the employees. When the employees are satisﬁed with their personal life, they are sure to give their best to the organization. This policy expresses the organization’s willingness to work for the betterment of the workforce and provides the range of facilities that the organization oﬀers. Ensure that the employees have latin small letter a safe, secure, and comfortable working environment with the help of our Employee Welfare Policy Template that is highly conﬁgurable to suit your organization’s needs. 
103	 Employee Welfare Policy@ In this policy, you will get: black circle The purpose of implementing this policy. black circle The organization’s belief about wellness towards the workers. black circle The applicability of this policy. black circle The necessary fundamentals of this policy. black circle The initiatives undertaken on the company’s part. black circle The essentials that need to be provided to the employees. 
104	 Employee Welfare Policy@ Employee Welfare Policy Template Sample@ Coral AI does everything within its powers to improve the employees’ life and make it more comfortable. We believe in rewarding the hard work that the employees do for us by giving them beneﬁts apart from latin small letter a better salary. 
105	 Employee Welfare Policy@ Purpose@ This policy explains the provisions regarding the organization’s eﬀorts to make the workspace latin small letter a more comfortable place for the employees. 
106	 Employee Welfare Policy@ Scope@ This policy applies to all the employees working under Coral AI full stop 
107	 Employee Welfare Policy@ Fundamentals of the Policy@ Coral AI guarantees that the standards and policies will be following the law. The company shall ensure an ethical and just working environment for the employees. The company MUST educate the employees about their rights at the time of joining the company. The company assures the employee’s safety from physical or mental abuse, humiliation, or harassment at the workplace. Any employee/ employer using threats or undue inﬂuence on the other employees shall face disciplinary actions. The employee shall not face discrimination based on religion, gender, caste, standard, ethnicity, marital status, pregnancy status, sexuality, or otherwise during the recruitment process of the employees or after bring hired into the organization. 
108	 Employee Welfare Policy@ Fundamentals of the Policy@ In case of migrant workers, the employer must ensure that the workers are aware of the contract’s legality by providing the agreement in the employee’s native language. The employees shall have latin small letter a clean, safe, secure, and healthy working environment at all times. The employees shall receive their payroll on time. The company guarantees that all the employees will be above the age of 16. The employees shall have all-time access to the water and lavatory facilities without any restrictions. The company shall support the employees’ growth opportunities and hold regular training and development sessions. 
109	 Employee Welfare Policy@ Initiatives by the Company@ The company shall undertake the following measures: Ethical Recruitment No discriminatory behaviors shall be practiced against the employees. Every applicant, irrespective of their caste, gender, religion, ethnicity, race, sexuality, or marital status, shall be treated equally. Freedom of Speech and Grievance Management The employees shall feel free to voice their opinions and thoughts or report any unjust activity in the organization. It is the company’s responsibility to look into these matters and come to latin small letter a solution. The company shall protect the employees against retaliation in case of whistleblowing.  
110	 Employee Welfare Policy@ Initiatives by the Company@ Access to Employee Records The employee shall have limited rights to the employee records. They shall be allowed to access their personal ﬁles to update the information or matters notiﬁed by the management thereof. Access to the other employee ﬁles, however, shall NOT be accessible by any employee. In case of breach of any of the provisions mentioned above, company is liable to take disciplinary actions against the employee. If the company is at fault, it shall rectify the mistake and compensate the employee for the losses and suﬀering they had to undergo. 
111	 Employee Wellness Program@ What is the Employee Wellness Program?@ Some hardworking people place their job over health. As latin small letter a company, we should understand this and oﬀer the employees latin small letter a series of advantages and activities that promote health. This program is known as an employee wellness program. Employee wellness programs are intended to improve employees’ health and ﬁtness often through preventative care. Wellness goals can include preventing acute diseases to decrease their health and economic load, rising employee motivation, and improving employees’ life quality. The Employee Wellness Program Policy is an initiative on the company’s part to educate their employees and create awareness among them about the company’s resources and programs to increase the employees’ immune system and stamina. 
112	 Employee Wellness Program@ What is the Employee Wellness Program?@ This policy shows the employee what types of programs are undertaken by the company for their health beneﬁts. It explains to them the need and importance of utilizing such programs. This policy elaborates on the provisions regarding the subscriptions and usage of such health resources and programs. 
